acmi_id,acmi_name,wikidata_id,wikidata_name,acmi_title,wikidata_title,match
72334,WILDWOOD ENTERPRISES,Q454028,ESTELLE WINWOOD,ALL THE PRESIDENTS MEN,THE MISFITS,55
72334,WILDWOOD ENTERPRISES,Q454028,ESTELLE WINWOOD,ORDINARY PEOPLE,THE CABINET OF CALIGARI,37
72334,WILDWOOD ENTERPRISES,Q454028,ESTELLE WINWOOD,THE ELECTRIC HORSEMAN,THE MAGIC SWORD,50
72334,WILDWOOD ENTERPRISES,Q459378,BEATRICE WOOD,ALL THE PRESIDENTS MEN,BEATRICE WOOD: MAMA OF DADA,21
72334,WILDWOOD ENTERPRISES,Q459378,BEATRICE WOOD,ORDINARY PEOPLE,BEATRICE WOOD: MAMA OF DADA,24
72334,WILDWOOD ENTERPRISES,Q459378,BEATRICE WOOD,THE ELECTRIC HORSEMAN,BEATRICE WOOD: MAMA OF DADA,38
